{
  "schemaVersion": "jobservatory.source-rights-register.v1",
  "generatedAt": "2026-08-25T09:52:56+00:00",
  "sourceRegistryVersion": "jobservatory-sources-2026-08-17.6",
  "sourceRegistrySha256": "sha256:ddcf29cbcca03a23126909888b2e09abf39bc5c671d37744062df40d1968fb19",
  "reviewInputSha256": "sha256:6bb7f41af3de502d2dade9ecc43a91cb238a5fe823ea24cf996d8813a5dcd737",
  "policy": {
    "fullDescriptionsRepublished": false,
    "sourceContentModelTrainingEnabled": false,
    "defaultDecision": "pending",
    "notice": "Public technical access is not a license. Every decision requires source-specific evidence and an accountable reviewer."
  },
  "summary": {
    "sources": 54,
    "actionableDecisions": 270,
    "approvedDecisions": 0,
    "pendingDecisions": 270,
    "rejectedDecisions": 0,
    "status": "pending"
  },
  "reviews": [
    {
      "sourceId": "ashby:abridge",
      "employer": "Abridge",
      "ats": "ashby",
      "sourceKey": "abridge",
      "sector": "healthcare-ai",
      "jobBoardUrl": "https://jobs.ashbyhq.com/abridge",
      "technicalAccess": {
        "accessBasis": "official-public-job-posting-api",
        "documentationUrl": "https://developers.ashbyhq.com/docs/public-job-posting-api",
        "documentationReviewedAt": "2026-08-17",
        "lastSuccessfulResponseSha256": "sha256:27785150b8189446a14e61d3d963a1ed241589ea8337596e9f144230e10fe2d5",
        "lastSuccessfulHttpStatus": 200
      },
      "retentionPolicy": "metadata-hash-short-evidence",
      "decisions": {
        "retrieval": "pending",
        "metadataRetention": "pending",
        "shortExcerptPublication": "pending",
        "redistribution": "pending",
        "modelTraining": "pending",
        "rawResponseRetention": "not_requested"
      },
      "decisionEvidence": {
        "employerTermsUrl": null,
        "reviewer": null,
        "reviewedAt": null,
        "notes": "Technical public-API access is documented, but no legal conclusion is inferred from accessibility. Employer-specific terms and an accountable review are still required."
      },
      "registryAligned": true,
      "blockers": [
        "metadataRetention",
        "modelTraining",
        "redistribution",
        "retrieval",
        "shortExcerptPublication"
      ]
    },
    {
      "sourceId": "ashby:cohere",
      "employer": "Cohere",
      "ats": "ashby",
      "sourceKey": "cohere",
      "sector": "frontier-model-lab",
      "jobBoardUrl": "https://jobs.ashbyhq.com/cohere",
      "technicalAccess": {
        "accessBasis": "official-public-job-posting-api",
        "documentationUrl": "https://developers.ashbyhq.com/docs/public-job-posting-api",
        "documentationReviewedAt": "2026-08-17",
        "lastSuccessfulResponseSha256": "sha256:fa66357721f1647eb385bbbe8a6cdbd4c9f0afb4be4fc48d796d81cf5c5141a9",
        "lastSuccessfulHttpStatus": 200
      },
      "retentionPolicy": "metadata-hash-short-evidence",
      "decisions": {
        "retrieval": "pending",
        "metadataRetention": "pending",
        "shortExcerptPublication": "pending",
        "redistribution": "pending",
        "modelTraining": "pending",
        "rawResponseRetention": "not_requested"
      },
      "decisionEvidence": {
        "employerTermsUrl": null,
        "reviewer": null,
        "reviewedAt": null,
        "notes": "Technical public-API access is documented, but no legal conclusion is inferred from accessibility. Employer-specific terms and an accountable review are still required."
      },
      "registryAligned": true,
      "blockers": [
        "metadataRetention",
        "modelTraining",
        "redistribution",
        "retrieval",
        "shortExcerptPublication"
      ]
    },
    {
      "sourceId": "ashby:decagon",
      "employer": "Decagon",
      "ats": "ashby",
      "sourceKey": "decagon",
      "sector": "enterprise-ai-agents",
      "jobBoardUrl": "https://jobs.ashbyhq.com/decagon",
      "technicalAccess": {
        "accessBasis": "official-public-job-posting-api",
        "documentationUrl": "https://developers.ashbyhq.com/docs/public-job-posting-api",
        "documentationReviewedAt": "2026-08-17",
        "lastSuccessfulResponseSha256": "sha256:3dd1276d317ec90aae290c826ebe53c8214040766d8d08c7426d3c6bc9b785dd",
        "lastSuccessfulHttpStatus": 200
      },
      "retentionPolicy": "metadata-hash-short-evidence",
      "decisions": {
        "retrieval": "pending",
        "metadataRetention": "pending",
        "shortExcerptPublication": "pending",
        "redistribution": "pending",
        "modelTraining": "pending",
        "rawResponseRetention": "not_requested"
      },
      "decisionEvidence": {
        "employerTermsUrl": null,
        "reviewer": null,
        "reviewedAt": null,
        "notes": "Technical public-API access is documented, but no legal conclusion is inferred from accessibility. Employer-specific terms and an accountable review are still required."
      },
      "registryAligned": true,
      "blockers": [
        "metadataRetention",
        "modelTraining",
        "redistribution",
        "retrieval",
        "shortExcerptPublication"
      ]
    },
    {
      "sourceId": "ashby:openai",
      "employer": "OpenAI",
      "ats": "ashby",
      "sourceKey": "openai",
      "sector": "frontier-model-lab",
      "jobBoardUrl": "https://jobs.ashbyhq.com/openai",
      "technicalAccess": {
        "accessBasis": "official-public-job-posting-api",
        "documentationUrl": "https://developers.ashbyhq.com/docs/public-job-posting-api",
        "documentationReviewedAt": "2026-08-17",
        "lastSuccessfulResponseSha256": "sha256:9b1a1477828aafe54e93c344e3d7bdff9bb1571ac8af55e12d566a083dc83f8b",
        "lastSuccessfulHttpStatus": 200
      },
      "retentionPolicy": "metadata-hash-short-evidence",
      "decisions": {
        "retrieval": "pending",
        "metadataRetention": "pending",
        "shortExcerptPublication": "pending",
        "redistribution": "pending",
        "modelTraining": "pending",
        "rawResponseRetention": "not_requested"
      },
      "decisionEvidence": {
        "employerTermsUrl": null,
        "reviewer": null,
        "reviewedAt": null,
        "notes": "Technical public-API access is documented, but no legal conclusion is inferred from accessibility. Employer-specific terms and an accountable review are still required."
      },
      "registryAligned": true,
      "blockers": [
        "metadataRetention",
        "modelTraining",
        "redistribution",
        "retrieval",
        "shortExcerptPublication"
      ]
    },
    {
      "sourceId": "ashby:perplexity",
      "employer": "Perplexity",
      "ats": "ashby",
      "sourceKey": "perplexity",
      "sector": "ai-search",
      "jobBoardUrl": "https://jobs.ashbyhq.com/perplexity",
      "technicalAccess": {
        "accessBasis": "official-public-job-posting-api",
        "documentationUrl": "https://developers.ashbyhq.com/docs/public-job-posting-api",
        "documentationReviewedAt": "2026-08-17",
        "lastSuccessfulResponseSha256": "sha256:298feb974afbddc37aa51bd6fb27299c3f97989bd47d54eae48e7158be7ddbd8",
        "lastSuccessfulHttpStatus": 200
      },
      "retentionPolicy": "metadata-hash-short-evidence",
      "decisions": {
        "retrieval": "pending",
        "metadataRetention": "pending",
        "shortExcerptPublication": "pending",
        "redistribution": "pending",
        "modelTraining": "pending",
        "rawResponseRetention": "not_requested"
      },
      "decisionEvidence": {
        "employerTermsUrl": null,
        "reviewer": null,
        "reviewedAt": null,
        "notes": "Technical public-API access is documented, but no legal conclusion is inferred from accessibility. Employer-specific terms and an accountable review are still required."
      },
      "registryAligned": true,
      "blockers": [
        "metadataRetention",
        "modelTraining",
        "redistribution",
        "retrieval",
        "shortExcerptPublication"
      ]
    },
    {
      "sourceId": "ashby:physicalintelligence",
      "employer": "Physical Intelligence",
      "ats": "ashby",
      "sourceKey": "physicalintelligence",
      "sector": "robotics-foundation-models",
      "jobBoardUrl": "https://jobs.ashbyhq.com/physicalintelligence",
      "technicalAccess": {
        "accessBasis": "official-public-job-posting-api",
        "documentationUrl": "https://developers.ashbyhq.com/docs/public-job-posting-api",
        "documentationReviewedAt": "2026-08-17",
        "lastSuccessfulResponseSha256": "sha256:5e9616cfa50c55e4ab9128844bbf70c08327c83feb205173630583913193f182",
        "lastSuccessfulHttpStatus": 200
      },
      "retentionPolicy": "metadata-hash-short-evidence",
      "decisions": {
        "retrieval": "pending",
        "metadataRetention": "pending",
        "shortExcerptPublication": "pending",
        "redistribution": "pending",
        "modelTraining": "pending",
        "rawResponseRetention": "not_requested"
      },
      "decisionEvidence": {
        "employerTermsUrl": null,
        "reviewer": null,
        "reviewedAt": null,
        "notes": "Technical public-API access is documented, but no legal conclusion is inferred from accessibility. Employer-specific terms and an accountable review are still required."
      },
      "registryAligned": true,
      "blockers": [
        "metadataRetention",
        "modelTraining",
        "redistribution",
        "retrieval",
        "shortExcerptPublication"
      ]
    },
    {
      "sourceId": "ashby:sierra",
      "employer": "Sierra",
      "ats": "ashby",
      "sourceKey": "sierra",
      "sector": "enterprise-ai-agents",
      "jobBoardUrl": "https://jobs.ashbyhq.com/sierra",
      "technicalAccess": {
        "accessBasis": "official-public-job-posting-api",
        "documentationUrl": "https://developers.ashbyhq.com/docs/public-job-posting-api",